signal_index,file_name,free_text_sensory,free_text_emotional,free_text_association
113,2411011811189.json,The sensation was a slow heartbeat,The sensation made me feel anxious.,The sensation reminded me of a heartbeat
113,2411011424189.json,The sensation is slow and there's a 1 second gap between two vibrations.,The sensation makes me feel active. ,The sensation reminds me of an alarm
113,2410301744189.json,The sensation is like a phone vibrating in your pocket.,The senation felt a bit fuzzy and it wad enjoyable.,"I have felt a similar sensation before, like a phone vibrating in my pocket and I pick it up while its vibrating."
113,2411011721189.json,The sensation felt like a heartbeat of some animal.,The sensation made me feel calm.,N/A
113,2411011630189.json,The senestion feels like a heartbeat,The sensation invokes the feeling of anxiety,The sensation reminds me of the moments before the results are announced
113,2411011525189.json,This signal feels like a heartbeat. It has two beats after each pause and is pretty slow ,It makes me feel comforted and calm ,It reminds me of a sonography wherein I could feel the heartbeat and sound 
113,2411011100189.json,the signal was slight buzz	,the signal gave a reassuring feeling	,the signal reminds me of a phone vibration upon receiving a message
113,2411051259189.json,Sensation is like a buzz notification inn your mobile which lasts for 1-2 seconds.,Sensation makes me alert or gets my attention instantly.,It reminds me of a mobile notification vibration or an alert
113,2411061548189.json,sensation is buzz		,sensation makes me feel greasy	,It reminds me of door bell ring
113,2411061645189.json,The sensation I felt was like a bumpy-feeling.,I could relate this to a pulse-check.,This sensation reminded me of me crashing any car in a video game.
114,2411011811189.json,The sensation is three continous buzzes which goes low-high-low,This sensation made me feel surprised,The sensation reminded me of a car honking
114,2411011424189.json,The sensation is a long buzz with very little gaps.,Te makes me feel anxious and feels like something urgent.,The sensation reminds me of getting late to an event.
114,2410301744189.json,"The sensation felt like a phone vibrating, with a long frequency.",The sensation made me feel a bit annoyed.,I have felt this sensation when an alarm went off and it was right next to my head.
114,2411011721189.json,The sensation was continuous and had few break-points.,This sensation made me feel alarmed and alerted. Some emotions that I can attach to it are that of panic.,The sensation reminded me of the fire alarm.
114,2411011630189.json,Sensation feels like slow continous vibrations,The sensation feels like slowed anxiety and confusion,The sensation reminds me when I was running across a field
114,2411011525189.json,This signal feels more panicy and fast. It has quick vibrations which get quicker by time and suddenly slow down. ,It makes me feel the need to do things very quickly and a little anxious. ,It reminds me of a gaming console racing car game. 
114,2411011100189.json,the vibrations were long in duration with changes in intensity		the ,the sensation gave a pleasent feeling	,it reminds me of vibrations felt when playing a musical instrument
114,2411051259189.json,this sensation is like a fast wave which lasts for 3-4 seconds ,This sensation makes me happy or ennjoyable,It reminds me of a wave travelling fast
114,2411061548189.json,sensation is like alarm	,sensation makes me feel like i am in a moderate panic state,It reminds me of phone vibration to get attentive
114,2411061645189.json,This sensation was like a buzz.,It makes me feel like a harsh vibration.,It reminds me of an Alert.
115,2411011811189.json,The sensation was continous wave which increases and decreases and has a pause in the middle,The sensation made me feel disconcerted,It reminds me of a vehicle moving and stopping
115,2411011424189.json,The sensation is steady and even.,The sensation makes me feel calm and the discomfort when it stops.,The sensation reminds me of a massager.
115,2410301744189.json,"The sensation felt like the waves of ocean, increasing and decreasing slowly and steadily.",This sensation made me feel relaxed.,This sensation reminds me of the standing near an ocean while the waves hit your feet.
115,2411011721189.json,The sensation was pretty continuous.,The sensation made me feel nothing apart from reassurance in a way. ,"It reminds me of the operation of an autoclave machine, upon its on set."
115,2411011630189.json,Sensation feels like tingling,The Sensation invokes a mix of happiness and anxiety,The sensation reminds me of when my brother was born
115,2411011525189.json,"This vibration begins slowly maintaining the speed, does not feel agressive. ","This vibration made me feel good, it had the perfect buzz which would soothe me. ",It reminds me of a massager used for massaging legs where it starts slowly and maintains momentum. 
115,2411011100189.json,the intensity of the vibration kept slowly increasing		,it gave a relaxing feeling,the vibrations reminded me of those felt on a video game controller
115,2411051259189.json,This sensation is more like a motor sound of a rice mill	,This sensation makes me warm and comforted	,This sensation reminds me of motor of a mill factory
115,2411061548189.json,Sensation is in a soothing way to give a relaxed feeling 	,It kind of makes me relax like a head massage procedure,It reminds me of gettings head massages
115,2411061645189.json,"This sensation makes me feel like I'm taking a massage, maybe. It has a constant waves which are pleasurable, indeed.",The vibrations were soft to feel and It was relaxing.,I felt like I was holding some accu-puncture product for muscle relaxation.
116,2411011811189.json,The sensation starts out loud and fades away,The sensation made me feel calm,This sensation reminded me of hitting some metal with a hammer
116,2411011424189.json,The sensation starts with a very strong buzz and the mellows down.,This sensation makes me feel discomfort due to it's inconsistency.,N.A.
116,2410301744189.json,The sensation feels like a big wave slamming your body.,This sensation makes me feel anxious.,This sensation reminds me of standing in front of a big wave while it's about to hit me.
116,2411011721189.json,The sensation started out slow then picked up momentum and repeated the same pattern twice.,The sensation made me feel calm first and excited in a way later when it amplified.,This sensation reminded me of my old phone's ringtone.
116,2411011630189.json,The sensation feels like a fast heartbeat,The sensation invoke mixed sadness and anxiety,Sensation reminds me of griping the ball before the last throw
116,2411011525189.json,"It is a Very slow and gentle sensation, just like air that passes quickly. ",This is way too slow and makes me feel a little irritated because it ends as soon as it starts. ,"It feels like the vibrations on bus or train, really slow and gentle. "
116,2411011100189.json,"the vibration starts off pretty intense and it gradually decline, with a short vibration in the end	",the vibration felt reassuring,it reminded me of the vibrations felt on a video game controller
116,2411051259189.json,this sensation is like starts on high frequency and it gradually decreases while it stops,this sensation make me fells like vibrating	,This reminds me of motor or a battery which is about to die or in the last stage of its capacity
116,2411061548189.json,It feels like a factory siren ,It was a siren sound that gives a sensation of something is going to start	,It reminds of the factory siren
116,2411061645189.json,"The sensation feels like a smooth wave, it is steady. It was like a perfectly engineered speed-braker :)","It makes me feel like there's a constant wave, coming-up.",I could resemble this sensation when I get on a boat; sailing.
117,2411011811189.json,"The sensation is a set of sporadic, irregular beats",The sensation was unsettling,"Yes, it reminds me of a marching band"
117,2411011424189.json,The sensation is small and prickly,The sensation makes me feel irritated and confused.,The sensation reminds me of someone poking their finger on my shoulder continuously.
117,2410301744189.json,The sensation is similar to water drops dripping from a closed faucet.,This sensation makes me calm.,The sensation reminds me of water slowly dripping from a roof into a puddle. 
117,2411011721189.json,The sensation had a lot of breaks in it.,The sensation made me feel steady and weird. The sensation was somewhat frictional.,"Yes, it reminds me of soldiers marching on a national holiday."
117,2411011630189.json,Sensation feels like a heartbeat,Sensation makes me feel like exhaustion,Sensation reminds of a aftermath of a football match
117,2411011525189.json,"This is a very mild and neutral sensation, you can feel it very quickly with a slight buzz. ","This sensation passed very quickly, it felt familiar and comfortable. ",This reminds me of notification on social media platforms like instagram on mobile phones. 
117,2411011100189.json,there were sudden bursts with slight taps	,the vibrations gave me a feeling of urgency,it reminds me of the vibrations felt when a mobile phone rings
117,2411051259189.json,This sensation is like someone is poiking you with a finger ,this sensation makes me irritated	,This sensation reminds me of sharp object 
117,2411061548189.json,It was a small buzz or nudge kind of feeling	,This kind feels like a small nudge,It reminds of someone giving a nudge
117,2411061645189.json,"The sensations was very electric-rythemical, it was going one by one and you could feel it like a heart-beat.",It makes me feel like charged.,"I have felt these vibrations when current passes through my body, in the cases like earthing."
118,2411011811189.json,The sensation was a chaotic continous vibration,The sensation made me feel energised.,The sensation reminded me of a video game controller
118,2411011424189.json,The sensation is coarse and rough.,The sensation makes me feel weird and feels dirty.,The sensation reminds me of driving vehicles on gravel.
118,2410301744189.json,The sensation feels like sitting in a car while going over a bumpy road.,The sensation feels a bit irritating.,This sensation reminds me of sitting at the back of the car while my mother drives on a mildly bumpy road.
118,2411011721189.json,The sensation was weirdly a blend of more than 1 sensation oscillating and making a pattern.,The sensation made me feel excited.,The sensation reminded me of drums that play during a festival. 
118,2411011630189.json,Sensations feel like a heatbeat but with short rapid intervals,Sensation makes me feel anxious and curious,Sensation reminds me of just finishing a exam after doing no study
118,2411011525189.json,The sensation starts with slower waves of vibration and as time passes gets a little aggresive. ,This sensation felt moderately prickly and was a litttle unpleasent to feel. It made me feel unconfortable and weird. ,"Recently I was pricked by a thorn in a bunch of flowers, this sensation made me resonate with that feeling of being pricked or stung. "
118,2411011100189.json,the vibrations were intense with some dips in intensity,the vibrations gave me a feeling of calmness,this was similar to the vibrations felt when playing a musical instrument
118,2411051259189.json,"this senstaion is very calm, slow and almost feels nothing has happened",This sensation makes me feel warm	,This sensation reminds me of cycle wheel while going on a road
118,2411061548189.json,This feels like a random concert noise in low magnitude,When you are in surroundings of concert. the concert vibrations looks like this,When i am around concerts i felt like this
118,2411061645189.json,"This sensation is like, when you don't have anything for too long and your stomach makes weird sounds. These vibrations were exactly like that. The Vibrations were very grainy.",It made me feel hungry.,"Yes, I've felt such kind of vibrations before, they are the first thing I feel when I'm very hungry."
119,2411011811189.json,The sensation was a continuous buzz ,The sensation made me feel calm,The sensation reminded me of riding a bike
119,2411011424189.json,The sensation is one long vibration that starts steady but slowly becomes gritty at the end.,The sensation makes me feel relaxed at the start and ends up being confusing.,N.A.
119,2410301744189.json,This sensation feels like putting your hand over a mixer grinder or blender.,I enjoy this sensation.,This sensation reminds me of using a blender to make a paste.
119,2411011721189.json,The sensation was continuous throughout.,The sensation made me feel calm and reassured.,The sensation reminded me of my water bike riding experience this summer.
119,2411011630189.json,Sensation feels like when your hand paralyze and you have a tingling,Sensation makes me feel afraid and curious,Sensation reminded me of when my hand fracture was removed
119,2411011525189.json,This sensation starts and ends in the same frequancy of vibrations. It is very constant and steady. ,The sensation was very active and pleasant. It makes me feel happy with a positive and calming effect that it brings. This vibration brings me a sensation of relaxation and rest.  ,The constant vibration reminds me of sitting in an aircraft and the feeling of starts to get stronger as the vibrations go by.  
119,2411011100189.json,the vibrations were steady and constant,the vibrations gave me relaxing feeling,the vibrations remind me of those felt when a washing machine is running
119,2411051259189.json,this sensation is like a small wheel is rotating with a high speed		,this sensation makes me feel rough	,This sensation reminds me of something even and flat
119,2411061548189.json,This was kind of ECG machine sounding,This kind of make me feel a machine is working on me to do some diagonosis,When i was examined for medical checkup I felt this kind of feeling
119,2411061645189.json,"The sensation was like, when we try to accelerate a car while pushing on the clutch.",It made me feel very unpleasent.,It made me feel very greasy and too much of a buzz-sound.
120,2411011811189.json,This sensation was a buzz followed by two quick beats,The sensation made me feel anxious,The sensation reminded me of a fast heartbeat
120,2411011424189.json,The sensation is rhythmic. ,The sensation makes me feel enjoyable and pleasant.,The sensation reminds me of beats of music.
120,2410301744189.json,This sensation feels like a marching rhythm. ,This sensation makes me excited.,This sensation reminds me of marching in the band following the rhythm of the drums. 
120,2411011721189.json,This sensation was a combination of 2 sensations oscillating but had different amplitudes and frequencies.,The sensation made me feel tensed and impending of something serious or important is about to happen.,The sensation reminded me of nerves pulsating in a human body.
120,2411011630189.json,Sensation feels like slow drumrolls beating,Sensation makes me feel happy and curious,NA
120,2411011525189.json,"This sensation could seem to be very familiar, slow in the begining and has a few bumps as it progresses ahead. ",The sensation initially made me feel a little anxious but later with the second vibration it made me feel enjoyable. It made me feel excited after feeling it twice. ,This sensation reminds me of the time when you are on some ride or roller coaster in the very initial stage before the ride actually starts. The sensation strongly associates with the machines starting on a roller coaster and makes you excited. 
120,2411011100189.json,the vibrations felt were sudden	,the vibrations gave me a feeling of urgency	,the vibrations were similar to those felt for a phone notification
120,2411051259189.json,this sensation is more like start and stop of rotating wheel with less frequency	,this sensation makes me fell iritating as it is not so smooth	,This sensation reminds of a bus horn
120,2411061548189.json,Bass of whoopher sound,Thumping energy feeling,Listening to music from speakers in a close area
120,2411061645189.json,"The sensation was like 1..23, 1..23 in sequence for me. there was a gap after the first beat and it felt very active.","It made me feel active, as If it's waking me up. I'd wakeup to this for sure as an alarm.","Yes, I feel it when I'm dancing; music."
121,2411011811189.json,The sensation had three scratches followed by a long buzz,This sensation made me feel tense followed by a release,N.A.
121,2411011424189.json,The sensation is uneven.,The sensation makes me feel angry.,N.A.
121,2410301744189.json,This sensation feels like a truck honking at you constantly.,"This sensation makes me feel a bit weird.
",This sensation reminds me of sitting in car while a trucking is honking constantly in a highway.
121,2411011721189.json,The sensation was a mixture of atleast 3 sensations together.,This sensation made me feel excited at first and calm after.,N/A
121,2411011630189.json,Sensation felt like when you get a tingling feeling in your hands after not moving it for a long time,Sensation makes me feel helpless and anxious,Sensation invokes a memory when I sat for entire hour without moving and my hand went numb with tingling sensations
121,2411011525189.json,The sensation is very similar to the pattern of an alarm or calls on phone when on vibrate mode. ,This senstaion makes me feel steady and calm since it feels like something you feel very regularly on a daily basis. ,This clearly reminds me on alarm or phone call when the phone does not have a volume feature. It is very common and part of daily routine. 
121,2411011100189.json,"the vibrations were repetitive, with low and high intensity",the vibrations gave me an exciting feeling,the vibrations were similar to those felt when a car upshifts and accelerates
121,2411051259189.json,This sensation is more like a machine or an engine which starts slow and picks up speed and eventually ends on low	,This sensation makes me feel like frictional	,This sensation reminds me of a running grinder 
121,2411061548189.json,Old car trying to start,Something is not working and i am trying hard to push it to limits,When starting an old car/bike 
121,2411061645189.json,"This sensation was exactly like, when you are out of gas in your car while you're crusing on a highway and your car makes weird noises while being decelerated.","It makes me feel tensed, worrying that something have happened.","Yes, A car/any subject getting dead any moment."
122,2411011811189.json,The sensation is a disconnected rumbling,N.A.,The sensation reminded me of a washing machine
122,2411011424189.json,The sensation is sharp.,The sensation makes me feel strong.,The sensatin remind me of EDM music.
122,2410301744189.json,This sensation feels like someone patting your back.,This sensation makes me feel a bit comfortable.,This sensation reminds me of my grandma patting my head while I try to sleep.
122,2411011721189.json,The sensation had a lot of breaks although the breaks were continuous.,The sensation made me feel neutral.,The sensation reminded me of my dishwasher.
122,2411011630189.json,Sensation feels like extremely slow drumrolls based like heartbeat,Sensation invokes anxiety and distress,NA
122,2411011525189.json,The sensation feels like a heartbeat but very slow and mild with only sibgle beat or vibration at a time. ,This sensation is very pleasant and pleasurable as it gives constant vibrations without breaking the pattern. ,It reminds me of music played in gym during our morning exercise and yoga session. 
122,2411011100189.json,the vibrations had medium intensity with sudden stops in between	,the vibrations gave me the feeling that something needs attention but it isn't too urgent,the vibrations reminds me of in-app notifications when using a mobile phone
122,2411051259189.json,This sensation is like long lastiing vibratin which is for about 5-6 seocnds	 ,This sensation makes me feel bumpy at times,This sensation reminds me of a motor which is in damaged state
122,2411061548189.json,a periodic drum beat,Getting a beat of energy,When listening to a start of song giving a intro kind of feeling.
122,2411061645189.json,"It is a firm noise, I could feel when I'm very anxious.",It makes me feel that something fishy is happening around.,"I didn't feel anything as such, it I can sense similar vibrations in me when I'm very anxious."
123,2411011811189.json,The sensation is two pulses repeating after an interval,The sensation made me feel ready to start a task,The sensation reminded me of an alarm
123,2411011424189.json,The sensation is bumpy ,The sensation makes me feel stress,The sensation reminds me of an ECG machine.
123,2410301744189.json,This sensation feels like a washing machine doing its job.,This sensation makes me feel neutral.,This sensation reminds me of hearing a top-load washing machine from a distance trying to wash some clothes as the clothes push against the wall of the drum.
123,2411011721189.json,The sensation had varying intensities in a single wave.,The sensation made me feel steady and composed.,The sensation reminded me of a washing machine spinning.
123,2411011630189.json,Sensation feels so neutral,"Sensation feels like a buzz, its irritating",Sensation reminds like a when my hands gets greasy and somethings starts falling from my hand
123,2411011525189.json,This can be described as very constant vibration at the begining with a very strong and intense vibration suddenly. ,This did not make me feel very good as it came with a sudden strong break making me get a feeling of sudden fear or anxiety. ,This reminds of of sitting a car which is waiting for a signal that starts suddenly. The vibrations go from being slow and neutral to coming on a strong halt suddenly. 
123,2411011100189.json,the vibration has a slow rise in intensity and a sudden drop in the end,the vibration makes me feel that something needs my attention,the vibrations were similar to that felt when a mobile phone rings
123,2411051259189.json,This sensation is more like a small fan rotating	for 2-3 seconds,This sensation makes me feel passive	,This sensation reminds me of a working small fan
123,2411061548189.json,scratcging a chalk piece on a black board	,This is kind of annoying feeling,When someone tries to scratch differnet materials on each other this kind of vibrations will be felt.
123,2411061645189.json,"It is a constant, unpleasant vibration, I've felt. It is definitely not comfortable to feel it for a long time.",It make me feel like a threat.,"It is very rough and a high intensity vibrations, I felt it when I was on ships."
124,2411011811189.json,The sensation was a fading pulse repeating over and over,N.A.,The sensation reminded me of a washing machine going fast
124,2411011424189.json,The sensation is fuzzy,The sensation makes me feel quiet and focused.,The sensation reminds me of a xerox machine.
124,2410301744189.json,This sensation feels like you are trying to kickstart a scooter.,This sensation makes me happy.,This sensation reminds me of my father trying to kickstart his old scooter.
124,2411011721189.json,The sensation  was continuous and transitioned quickly and smoothly when theree was a break between the two.,The sensation made me feel quiet.,The sensation reminded me of the tredmill in the walking mode.
124,2411011630189.json,Sensation feels of thrill and adventure,Sensation makes me feel happy and achieving,"Sensation invokes of when I climbed a high hill, and after reaching its peak"
124,2411011525189.json,It can be described as active sensations that you keep feeling constantly and know what to expect next also knowing it will last long. ,This makes me feel a little panicky and sensual becuase of long pauses in the middle followed by constant vibrations. ,This relates to the vibrations very similar to an electronic razor or trimming device. The senstaion comes with even pauses and not very intense vibrations. 
124,2411011100189.json,the vibration has a steady rise and a steady fall in intensity	,the vibrations gave me an irritating feeling,the vibrations felt were similar to that felt when the dryer is on
124,2411051259189.json,This sensation is more like low vibration or almost nothing has happened type,This sensation makes me feel buzzing	,This sensation reminds of a mobile buzz placed on a table which is next to your bed 
124,2411061548189.json,something more like a squeeky noise,when a non functional door makes a squeeky noise when it was opened,When i open an old door which is locked for months then this squeeky noise was felt
124,2411061645189.json,"The sensations were a little wooly and they didn't seemed to be constant. It was like a motor working on three operations, and getting back to the square one.",It was like a motor with three level mechanism/operations.,I never felt these kind of vibrations. N.A.
125,2411011811189.json,"The sensation was very grainy, like running my hand through rocks",The sensation  made me feel uneasy,The sensation reminded me of shaking a jar with stones in it
125,2411011424189.json,The sensation is rhythmic.,The sensation makes me feel pleasant and comfortable.,The sensatin reminds me of the beats to a song.
125,2410301744189.json,This sensation feels like a scooter is just about to start.,This sensation makes me excited.,"This sensation reminds me of my father's old scooter when it is about to start and the motor makes some noise, but it eventually stops."
125,2411011721189.json,The sensation was very discontinuous although it followed an interesting pattern.,The sensation  made me feel pleasant and active.,The sensation reminded me of the starting part of the song : 'Believer' by imagine dragons.
