signal_index,file_name,free_text_sensory,free_text_emotional,free_text_association
49,2409261633145.json,THE VIBRATION WAS LIKE CONVEYING A MESSAGE ,IT MADE ME FEEL SOMETHING COULD BE DECODED FROM THE SIGNAL,REMINDS ME OF A SECRET COMUNICATION
49,2409261719145.json,The sensation was discontinous with two short pulses followed by a long pulse.,It made me feel weird.,It reminds me of the sound made by frog.
50,2410031239145.json,This sensation started with a continuous pulse which fades out towards the end		,This sensation felt calm.	,"This sensation reminds me of beach, similar to waves coming on shore and then dying. "
50,2410041227145.json,This sensation is stimulative. Its slow but course but also maintains a rythm. Its a repetitive beat of 1 second buzz each.,"This sensation made me feel enjoyable, aggresive, exciting.",This sensation reminds me of the feet massaging tool which moves around itself to provide the treatment.
50,2410041330145.json,this sensation reprating high intensity vibrations with longer intervals  ,this sensation makes me feel alarming situation,this sensation reminds me rhythmic alarm someting needs your attention but not important 
50,2410021558145.json,This sensation was very strong,The sensation makes me feel to stop doing anything,This reminded me of my game character loosing most of health. 
50,2410041057145.json,The sensation is a long buzz followed by a small pause with three succesive pulses after that and then another buzz that a small pause before it starts. ,The sensation made me feel active and awake. The emotion I can attach is being happy.,N.A.
50,2409300909145.json,This sensation is like the feeling of your body being relaxed after a very hectic day.,This sensation makes me feel calm and happy.,This sensation remings of the time I was given leg massage.
50,2410031345145.json,"It was a irregular pulse, growing intensive.",It made me feel exhilerated.,It sound like a car engine is starting
50,2409301045145.json,This sensation has 4 long vibrations. First 3 are high vibrations and the last one has two parts in which in the first part the vibrations are intense and then ends by declining rate.,This sensation makes me feel buzz,This sensation reminds me of drilling machine that is used to bore well
50,2409251812145.json,This was two long spaced apart buzzes followed by two quick buzzes,This sensation made me feel anxious,This sensation reminds me of a warning alarm that is building in urgency
50,2409261633145.json,THE SENSATION SEEMED LIKE A FADING SPEECH,IT MADE ME FEEL EXCITING INITIALLY BUT THEN LOST ITS MOMENTUM,REMINDED ME OF A FADING VOICE FROM FAR AWAY
50,2409261719145.json,The sensation was random consisting of long vibrations.,It was very familiar.,It reminds me of my phone ringing.
51,2410031239145.json,"This sensation started with a pulse of steady intensity and then another pulse, of higher intensity, takes over",This sensation felt energetic.,"This sensation reminds me increasing the speed of the car on the freeway,for a short time, after driving at steady speed for a long time."
51,2410041227145.json,"This sensation is pleasant, not too serious of a mixture of buzzes. Its rythemic too like a piano being played.",This sensation makes me feel aroused and excited and interested as to what is next.,It reminds me of the feeling when there is too much tension and element of surprise in any situation.
51,2410041330145.json,this sensation is varing low to mid varing vibrations	,this sensation feels like ready or active ,this sensation reminds of when your device or machine is ready to go
51,2410021558145.json,The sensation was not too strong but cannot go noticable,The sensation makes me feel passive,This reminds me of getting updates continously about something
51,2410041057145.json,The sensation is two short buzzes and a long buzz playing cyclically and rythmically.,I can say that the sensation makes me feel famililar. The emotion I can attach is that I feel a little anxious.,This reminds me of taking deeps breaths after a sprint session.
51,2409300909145.json,This sensation  is like the sound of a washing machine. ,This sensation makes me a feel like I have got an alarm,This sensation reminds me of em starting me bike.
51,2410031345145.json,"I would describe it as Regular, and small beats.",It makes me feel nonchalant.,It sound like something small is stuck on a wheel and it is constantly banging at every turn
51,2409301045145.json,The sensation has 2 repeating vibrations. The first vibration is a beat of medium vibration and second one is a long vibration like a wave that increases the intensity and then drops.,This sensation makes me feel sleepy,This sensation reminds me of a machine boring a well
51,2409251812145.json,This sensation is a low vibration followed by a louder one,This sensation made me feel alert,This reminds me of a police siren
51,2409261633145.json,IT WAS LIKE POINTING TO SPECIFICS IN THE END,IT MADE ME FEEL LIKE CONVEYING A SPEICIFC MESSAGE IN THE END ,REMINDS ME OF AN ORATOR TALKING RELEVANT TO THE TOPIC WITH NON RELEVANT POINTERS IN THE BEGINNING
51,2409261719145.json,The sensation had a pattern with two medium length vibrations which were in sync.,The sensation was enjoyable.,Yes it reminded me of pop music.
57,2410031239145.json,This sensation comprises of regular set of pulses of very low intensity,This sensation feels annoying and unpleasant,This sensation does not remind of anything 
57,2410041227145.json,This sensation is a low haptic steadxy beat with almpst no buzz. Its dry. Could be used as background for something.,It makes me feel like clock is ticking extremely fast and everything is quiet except the clock. Its boring and gritty.,N.A.
57,2410041330145.json,this senstion low intensity repeating long interval vibrations ,this sensation feels intense,this reminds of clock timer coming to end
57,2410021558145.json,The sensation was small and fast.,This sensation makes me feel allerted,This reminds me of the time ticking in last phase of any event where activity is time bound
57,2410041057145.json,The sensation is like a pointy and alarming buzz that plays continously.,The sensation makes me feel enjoyable and active. The emotion I can attach is being happy and calm.,This sensation reminds me of starting my motorcycle in India.
57,2409300909145.json,This sensation is like raindrops falling on the ground.,This sensation give me a sense of pleasure.,This sensation reminds me of a time when I had to deal with very heavy rainfall.
57,2410031345145.json,I would describe it as constant knocking at a high frequency. ,It make me feel anxious.,It can be associated to machine gun shooting which is muffled. 
57,2409301045145.json,The sensation is of continuous low vibrations.,This sensation makes me feel satisfactory,This sensation reminds me of a ticking clock
57,2409251812145.json,This sensation is a series of short low beats,"This sensation makes me feel irritated, like something is bothering me",This sensation reminds me of shaking an object inside a jar
57,2409261633145.json,SEEMED LIKE A DIMMING OBJECT,MADE ME FEEL PASSIVE,WHEN A LIGHT DIMS ON THE STREET
57,2409261719145.json,The sensation was continous with a series of repeating short pulses.,It made me feel good.,It reminded of the sound of water falling drop by drop.
58,2410031239145.json,This sensation comprise of 1 continuous pulse on top of which number of other pulses (of higher intensity) takes place,This sensation feels chaotic,"This sensation reminds of the time of early 2020, around the time when covid outbreak started where chaos and unpredictability was evident. "
58,2410041227145.json,This sesation is a steady buzz with a hint of supressed beat.,This sensation makes me feel enjoyable and active.,It reminds me on a happy summer day.
58,2410041330145.json,this sensation continuous high to low vibration with no intervals,thsi sensation makes me feel exciting,this sensation reminds me of enegetic sitution like rock band concert 
58,2410021558145.json,The sensation had normal repetitions of medium level vibrations ,The sensation makes me feel active,This reminds me of high base sound system
58,2410041057145.json,"The sensation is intense, active and high paced vibrations.","This sensation makes me feel energetic, excited. I can say that my emotions were elevated.",The sensation reminds of a buzzing in a concert or music festival in crowd.
58,2409300909145.json,N.A,This sensation makes me feel aggressive.,This sensation reminds me of a time when I was not able to start my vehicle and it was just making some weird noises
58,2410031345145.json,It can be described as multiple pulses back to back. ,It makes me feel energetic and excited.,It feels like electronic music intro at a music festival.
58,2409301045145.json,"The sensation is of a continuous high vibration, along with repeating continuous intense vibration beats",This sensation makes me feel unpleasent,N.A.
58,2409251812145.json,This sensation is a series of four fast buzzes moving up and down,This sensation was energetic,The sensation reminds me of a snake climbing up my skin
58,2409261633145.json,THE VIBRATION WAS WAVY,THE SENSATION MADE ME FEEL BUMPY,IT MADE ME FEEL WHEN DRIVING IN BUMPERS ON THE ROAD
58,2409261719145.json,The sensation consisted of series of repeating medium length vibrations,The sensation made me feel thrilling.,It reminds me of someone knocking the door continuously.
59,2410031239145.json,This sensation starts with a steady pulse followed by short pulse and they both play on loop,This sensation felt rubbery.,This sensation reminded me of going down the brick paved road on my bike and experiencing the pattern same as this sensation
59,2410041227145.json,This sensation is fast paced buzz beats which keep circling from their low to highest base vibration.,"It makes me feel excited, thrilled and enjoyable.",This sensation reminds me of a techno rave.
59,2410041330145.json,this sensation is varing low to mid level vibration with no intervals ,this make me feels panicky and unpleasant,this sensation reminds me of situation when your machine is about to break down
59,2410021558145.json,This sensation is strong with medium frequency,The sensation makes me feel simulative,N.A
59,2410041057145.json,The sensation is a small pulse followed by a long pulse playing continuously and rythmically.,This sensation makes me feel intense and active. I can attach the emotion of anger.,This sensation reminds me of a heart beat after running.
59,2409300909145.json,This sensation gives the same sound feeling as an autorickshaw being driven on the road.,This sensation makes me feel like I want to go out and travel.,This sensation reminds me of the time when I was homesick for such a long time during covid and I justn wanted to get out of the house.
59,2410031345145.json,It can be described as a constant vibration with certain beats in it. ,It makes me feel familiar and pleasant. ,It reminds me of theme to musical theatre. 
59,2409301045145.json,"The sensation is of a continuous set of 2 vibrations, first one a high vibration beat and second one a slight longer vibration declining from high to low.",This sensation makes me feel active.,This sensation reminds me of a rock band
59,2409251812145.json,This sensation is a one-two beat with the second beat being longer,"This sensation made me feel energetic, like I am anticipating something",This sensation reminds me of revving a motorcycle
59,2409261633145.json,IT WAS LIKE HAVING A CONVERSATION WITH/LISTENING TO AN ENERGETIC PERSON,MADE ME FEEL ENERGETIC,IT REMINDED ME OF LISTENING TO A MOTIVATOR
59,2409261719145.json,The sensation was continous with a series of alarming vibrations.,It made me feel attentive.,It reminded me of the sound of ambulance.
64,2410031239145.json,This sensation is made of the number of low intensity pulses spready at unregular intervals	,This sensation felt like buzz	,This sensation reminded me of flying drone and hearing the sound of that when it was near
64,2410041227145.json,This sensation is a steady course/rough buzz that is supressed.,This sensation makes me feel uncomfortable and tense.,It reminds me of a start/end of an extremely important event like a life or death situation.
64,2410041330145.json,this sensation varing low intensity vibrations ,this sensation is unpleasant and bad,this sensation reminds me of time when trimmer battery is about to die 
64,2410021558145.json,The sensation was long vibrations with rhythm ,This sensation makes me submissive,This reminds me of school bell ringing
64,2410041057145.json,The sensation is coarse and grainy buzz that is slow and steady.,This sensation makes me feels unpleasant. I can attach the emotion of feeling weird.,This sensation reminds of a mixer grinding coarse rice slowly.
64,2409300909145.json,This sensation is like a vegetable being boiled on the gas stove and it is ready to be served.,This sensation makes me feel excited.,This sensation reminds me of a time when I was very hungry and my stomach was asking for food.
64,2410031345145.json,It can be described as dim like a crackling pulse.,It makes me feel enjoyable. ,It remindsbe of small crackers bursting/crackling.
64,2409301045145.json,The sensation is of coarse continuous medium vibrations,This sensation makes me feel anxious,This sensation reminds me of the noise that comes from the construction work
64,2409251812145.json,This sensation builds up to an intense buzz fast and then fades away just as quickly,This sensation makes me feel alarmed,This reminds me of an emergency alarm when some system shuts down in a scientific facility
64,2409261633145.json,THE BUZZ WAS MORE LIKE SOMETHING WAS SWINGING,IT INSTILLED ME A SENSE OF TRINKELING,IT REMINDS ME OF THE OLD CYCLE BELL WITH THE TRINKLING SOUND
64,2409261719145.json,The sensation consisted of a series of short vibrations followed by a long vibration made up of the short vibrations.,It made me feel irritating.,It reminded me of switching different stations on radio.
65,2410031239145.json,This sensation starts with 3 short pulses of medium intensity and then ends with longer pulse		,This sensation felt anxious,This sensation reminded me of my competitive track days when the empire is counting down from 3 and then shoots air pistol to give a green signal for the race
65,2410041227145.json,This sensation is very random and non rythemic wuth short haptics and then a buzz. It is lumpy. ,This senstaion made me feel very neutral and submissive - too much of it would be weird.,This reminds me of the random noises one makes when theyre bored.
65,2410041330145.json,this sensation has low intensation with variation is intervals and vibration timing  ,this senation makes me feel dissatisfied ,this sensation reminds me of dissatisfied alarming situation
65,2410021558145.json,The sensation was small and had pause after some intervals,This sensation makes me feel calm,This reminds me of buzz in kids toys
65,2410041057145.json,The sensation is non rhythmic but consists of two small pulses followed by a long buzz/ pulse.,This sensation makes me feel bad. I can attach the emotion of feeling disgust and being uncomfortable.,N.A
65,2409300909145.json,This sensation is like the sound of pressing a button,This sensation gives me a feeling of thrill.,I have an idea of this sensation from when I used to play online video games and would require continuous use of keypads and video controllers.
65,2410031345145.json,I would describe it as irregular and sporadic.,It makes me feel lethargic. ,It reminds me of a broken machine.
65,2409301045145.json,"The sensation is a repeating pattern of 7 vibrations, first 3 and last 3 are medium vibration beats, and the center one is a skight longer high vibration",This sensation makes me feel enjoyable,N.A.
65,2409251812145.json,This sensation is three short buzzes followed by a long buzz followed by three short buzzes again,N.A,This sensation reminds me of someone playing the guitar by plucking the strings and then playing a chord
65,2409261633145.json,IT WAS LIKE A SICK PERSON (IN BAD HEALTH) WAS ABOUT TO CONVEY SOMETHING,IT WAS LIKE SOMEONE WAS COUGHING,REMINDS ME OF MYSELF TRYING HARD TO SPEAK WHILE I HAD COUGHS 
65,2409261719145.json,The sensation consisted of 5 vibrations followed by a long pulse.,It made me feel neutral.,It reminede me of whistle sound.
47,2410041611156.json,The pattern of the sensation is slow and with small vibrations in a certain pattern.,The sensation feels like comfortable.,I feel like it is sensation of a heartbeat.
47,2410101326156.json,"The sensation I felt was like a ticking pattern  and there was a gap between 2 ticking. Also,  you should try to sense the sensation as much carefully.",I felt this sensation to be neutral.,"Yes, this sensation was somewhat similar to heartbeats."
47,2410111101156.json,N/A,The sensation makes me feels calm,This reminds me of a some light object falling
47,2410101211156.json,The sensation is very mild and steady. The 2 beats were repeating constantly and it felt comfortable.,This sensation made me feel calm and relaxed.,This sensation reminds me of a normal person's heartbeat.
47,2410101114156.json,The sensation was rhythmical ,The sensation makes me feel calming		,It reminds me of my phone when kept in vibration mode
47,2410081614156.json,The sensation is a rhthymic heartbeat.,NA,I have felt this before while watching movies.
47,2410111005156.json,"The sensation was very light, repeating and short in duration",The sensation made me feel quite and just barely noticeable,This reminds me of slight movement of table lamp or something light
47,2410090912156.json,The sensation is a low amplitude loop that repeats for short duration.,The sensation makes me feel good or familiar.	,Sensation reminds me of in video game tutorial when the controller is trying to correct my action.
47,2410091549156.json,"I can feel a medium frequency sensation which is in a rythm and goes like high, medium and low.",N.A,It is similar to heart beat.
61,2410041611156.json,The sensation is mixture of fast and slow vibrations. ,It makes me feel not steady.,I would say this sensation makes me feel like I am riding on a motor boat.
61,2410101326156.json,This sensation was like a ticking pattern mixed with some kind of grainy vibration.,N.A	,N.A
61,2410111101156.json,This sensation is like we can feel the vibration intensenly,This sensation makes me feel bit vibrant kind of strong,This sensation reminds me of the smart watch alarm 
61,2410101211156.json,The sensation was very harsh and also there was no delay or any gap in between the vibrations which was a bit annoying. ,This sensation made me feel uncomfortable. The continuous hard vibrations made it unpleasant.,This sensation reminded me of an alarm clock.
61,2410101114156.json,The sensation was intense and full of energy,This sensation made me energetic,This reminded me of a massage chair
61,2410081614156.json,The sensation was a long pulse of two vibrations.,It makes me feel intense.,The sensation reminded me of rhythmical machine.
61,2410111005156.json,"The sensation was in 2 parts, first was short and the second was longer. And it was quit overall",This sensation made me feel good and active,It reminded me of signals from a fitness band or some electronic wrist band.
61,2410090912156.json,The sensation is blast of two waves split by very short duration that repeat for a short duration.,The sensation feels like warning or a feeling that dissaudes me with some urgency.	,The sensation reminds me of failure in quick time events in games.
61,2410091549156.json,The sensation was strong and it went on a high note followed by a medium vibration longer than the note.,The sensation made me feel active.,This was similar to a buzzing sound of a phone or tablet.
67,2410041611156.json,It feels like fast vibrations with slow frequency.,It makes me feel like unpleasant as I want to either stop it or make it faster.,This sensation makes me feel like I am sitting on a parked motorcycle with engine on.
67,2410101326156.json,I would describe it as the combination of grainy plus firctional sense.,the sensation was somewhat frictional.,N.A
67,2410111101156.json,"This sensation is not continuous, it's like there are some jerk in between ",This sensation makes me feel discomfort i would say,This sensation reminds me of the medium vibration happens during the mobile alarm
67,2410101211156.json,This sensation was a bit bumpy with sets of 3-4 beats vibrating with a delay. It was more of a neutral sensation.,This sensation made me feel a bit discomfort but not that much to be unpleasant.,The sensation reminded me of a cell phone vibrating whenever one gets a call.
67,2410101114156.json,This sensation were annoying. It was not rhythmical,It made me feel discomfort	,It reminds me the sound of an engine
67,2410081614156.json,The sensation was noisy and coarse but with short burst.,It makes me feel discomforting.,It reminds me of bumpy and noisy but even speadbreakers.
67,2410111005156.json,"The sensation was repeating, steady and subtle.",This sensation made me feel soothing and quite,It reminded me driving in a car and the patterns felt due to the smoothness of road.
67,2410090912156.json,The sensaion is a fast paced repeating loop of short lasting waves.,The sensation feels  comforting and calming.,The sensation reminds me of the feeling of getting ready for some task.
67,2410091549156.json,The sensation is of a low frequency which is goes on like a medium note of vibration.,This sensation feels good.,This is similar to a vibration of cutting a really thick sheet of cardboard if listened continuously.
68,2410041611156.json,I would say that the vibrations starts with slow frequency and the frequency gradually increases overtime.,The sensation makes me feel reassuring.,It reminds me of a barber using trimmer to cut hair.
68,2410101326156.json,The sensation was a pattern with low vibration initially and the vibration gradually increases.,N.A,"i used to use electric heating vibrator for period cramps, this sensation remind me to that sense."
68,2410111101156.json,This sensation is like if the vibration happens from low to high speed,This sensation makes me feel like there is a buzz happening when I feel,"This sensation reminds me when we just about to start the scooter, when the engine runs it makes this kind of vibration"
68,2410101211156.json,The intensity of the vibration increased with time and restarted after a delay. The vibration was good.,This sensation felt energetic and a bit aggressive.,This sensation reminded me of a motorbike engine starting.
68,2410101114156.json,This sensation were rhythmical and steady. It went in ascending order	,It made me feel comforted,It reminds me of a foot massager
68,2410081614156.json,The sensation is a pulse that grows stronger until a point and drops drastically.,The sensation makes me feel familiar.,The sensation reminds a revving engine.
68,2410111005156.json,The sensation was very light in the start and the intensity increased graddualy and halted of a sudden.,The sensation made me feel arousing.,This sensation reminded me of a machine starting
68,2410090912156.json,The sensation is rising wave of rising series of waves repeating in short intervals.,The sensation feels exciting or thrilling,The sensation reminds me of when I just finished some thrilling activity 
68,2410091549156.json,This sensation goes on like a buzz sound from lower to a higher frequency note.,This sensation is relaxing.,This reminded of a the ring while we wait for the reciever to answer a call.
69,2410041611156.json,The sensation is like a medium burst of vibrations and then are released for it to get slow.,This sensation makes me feel excited.,It reminds me of me trying to accelerate a parked motorcycle.
69,2410101326156.json,It was a steady vibration.,I found this sensation to be energetic.,The sensation was like of a vibration/sense after hitting a bell.
69,2410111101156.json,The sensation is a continuous high speed vibration with out any jerk in between,This sensation makes me feel irritating and bit harsh,This sensation reminds me of the snooze happens in the mobile alarm
69,2410101211156.json,The sensation was thumpy and intense. The vibrations were steady and the intensity went high to low.,This sensation made me feel anxious and alarming. ,The sensation reminds me of beating a big musical drum.
69,2410101114156.json,"The sensation were exciting and thrilling, It was more like an alarm clock",It makes me feel electric,It reminds me of alarm clock
69,2410081614156.json,The sensation is a pulse that grows more profound and stops abruptly.,The sensation makes me feel alarmed and urgent.,The sensation reminds me of an alarm.
69,2410111005156.json,"The sensation was struck intensly in the start, then echoed and stopped",This sensation made me feeel good and calm,This reminded me of the gongs or ringing of bells in the temple.
69,2410090912156.json,The sensation is a quick repeating loop with high amplitude waves.,The sensation feels alarming,The sensation reminds me of warning or trigger given in video game tutorials
69,2410091549156.json,The sensation was a high frequency sensation going from a higher note to a lower one decreasing gradually. It is like someone ,This sensation makes me feel urgent.,This sensation is similar to a the hammer hit game. The sensation produced is same as the one after hammer strikes the surface.
70,2410041611156.json,The sensation has very small intervals in between where the frequency gets slow and overall this pattern increases slightly.,This sensation makes me feel like gritty.,It reminds me of a low frequency water flosser.
