signal_index,file_name,free_text_sensory,free_text_emotional,free_text_association
161,2411151004110.json,I would describe the sensation to someone else as a drum beat a drummer would play.,The sensation makes me feel comfortable. I feel relaxed by this sensation	,The sensation reminds me of a marching band when playing a drum. I can associate the sensation with a drum beat.
161,2411131621110.json,The sensation is intense and frequent.,It makes me feel alarmed and anxious.,It feels like an alarm.
161,2411131121110.json,The signal gives me the sensation for moving fast and intense.,I feel somehow anxious.,It makes me to think about to talk to my boss.
161,2411141349110.json,This sention feels like there is continous vibration after intervals,it makes me feel foggy,It reminds me of music beats
161,2411141231110.json,The sensation is a constant light vibration with 3 short but bigger vibrations happening.,It makes me feel like I should be prepared for something and I feel the emotion of excitement.,"The sensation reminds me of motorcycles and the feeling when you turn the pedal I think. I don't ride a motorcycle, but it seems like that."
150,2411130944110.json,This signal can be described as continuous signal with a sudden discontinuity. ,I felt like I am confused.,N.A
150,2411151103110.json,sensation felt very jagged and aggressive,Sensation made me feel fearful,NA
150,2411121648110.json,this sensation is very annoying. it consist of some random strong patterns .,this sensation makes me feel very annoying.,this sensation reminds me of riding on a bike in freeway
150,2411121537110.json,The sensation was 3 high pulses of vibration followed by dampened pulse of vibration.,The sensation made me feel distressed.,It reminded me like an appliance that failed to start properly.
150,2411141111110.json,This sensation is like a directionless pulsing.,This sensation makes me feel encouraged.,This reminds me of the beat of a loud energetic song.
150,2411151004110.json,I would describe the sensation as a zigzag pattern to someone else. ,The sensation makes me feel as if there is some urgency that needs to be resolved. I feel anxious about this sensation.	,The sensation reminds of when I have an urgent task that needs to be completed. I can associate working hard with this sensation.
150,2411131621110.json,The sensation is intense and changing frequency.,It makes me feel excited.,It reminds of a feeling of about to score a goal in a soccer match.
150,2411131121110.json,The signal gives me the sensation for moving not really smothly.,I feel a little bit weird and discomfort.,It makes me to associated to eat a boring lunch.
150,2411141349110.json,This sensation is like 2 beats at once,this sensation makes me feel disorganized,It reminds me of my phone buzzing 
150,2411141231110.json,The sensation is 2 vibrations followed by 4 rapid vibrations.,The sensation fills me with the feeling of adrenaline or fighting.,"The sensation reminds me of fighting , and the 4 rapid vibrations feel like 4 distinct hits."
151,2411130944110.json,This signal can be described as one intense vibration follow by sudden reduction in intensity.,I felt like I am anticipating for something.,This reminds me of shifting to higher gear in a manual sports car.
151,2411151103110.json,Sensation felt very frictional and sporadic,Sensation felt like Intimidating,This sensation reminds me of a chain saw.
151,2411121648110.json,this sensation starts with two storng short patterns followed by 2 mild gestures.,this sensation makes me feel attentive.,this sensation reminds me of focusing in a game.
151,2411121537110.json,The sensation was a high and long pitched vibration followed by softer rhytmic pulses.,It made me feel festive.,The vibration reminded me of the drumlike high pitched traditional chinese instrument being played in a lion dance.
151,2411141111110.json,This sensation is like a POW powpowpowpow repeated.,This sensation makes me feel apprehensive.,This reminds me of tapping on the same muffled piano key.
151,2411151004110.json,I would desribe the sensation as a long pulse to someone else,The sensation makes me feel good. I can attach being happy with this emotion.,The sensation reminds me of being on a vacation. 
151,2411131621110.json,The sensation is intense and fast.,It makes me feel like schoked or exploited.,It reminds of knowing missed deadlines for homeworks.
151,2411131121110.json,The signal a sensation for moving not so fast but not really slow.,It makes me yo feel uncertain adn undecided.,It makes me to associated to watch a sporatic movie.
151,2411141349110.json,the sensation feels continous and tingly,this sensation makes me feel annoyed,NA
151,2411141231110.json,There's a long and strong vibration followed by 4 light and short vibrations.,It makes me feel sad and frustrated like I did an action but it didn't work.,"It reminds me of the time my car wouldn't start. Pushing the engine key would be the long vibration, and the 4 light vibrations would be it not starting."
152,2411130944110.json,This signal is two continuous beats with a third vibration of reducing intensity.,N.A,N.A
152,2411151103110.json,Sensation felt like vibrating and buzzing in a pattern,Sensation felt very annoying,Felt like someone is crying
152,2411121648110.json,this sensation starts with two strong buzzes followed by a wavey pattern.,this senstion makes me feel puzzled.,this sensation reminds me of surfing
152,2411121537110.json,The sensation was like a rhytmic low pitch vibration followed by a stutter.,It was soothing and upbeat at the same time.,It reminds me of a drum being played.
152,2411141111110.json,I owuld describe this sensation as a tap tap taptaptaptap repeated. ,This sensation makes me feel alert.,N.A.
152,2411151004110.json,I would describe the sensation as a notification.,This sensation makes me feel annoyed,The sensation reminds me of being on a rough road. I can associate being annoyed with this sensation
152,2411131621110.json,It is intense and smaller bips followed by longer one.	,It makes me feel hopeful.,It reminds me of being confident about something.
152,2411131121110.json,The signal gives me a sensation for neat and tight.,It makes me to feel calm and quiet.,It makes me to associated to have a regular training in the gym.
152,2411141349110.json,This sention feels like 2 to 3 vibrations together and it feels smooth at first,It makes me feel normal,NA
152,2411141231110.json,The sensation is two medium vibrations followed by one that's a little longer and a little stronger.,The sensation makes me feel alert or angry.,It reminds me of an intense feeling or an alarm waking me up or the feeling of not wanting to go to school when an alarm does wake me up.
153,2411130944110.json,This signal can be decribed as a signal which decrease intensity.,I feel like I am anticipating for something. , N.A
153,2411151103110.json,Sensation felt slippery and discomfortable,Sensation made me feelIt made me feel nervous and panicky,Sensation Felt like slipping on a upwards slide.
153,2411121648110.json,this sensation is very confusing.it starts with two strong buzzes tapering with short mild ones.	,this sensation makes me feel very confusing.,this sensation reminds me of solving a math problem.
153,2411121537110.json,"It was a very soft yet high frequence long vibration, followed by muffled sporadic burst of vibrations.	",It made me feel stagnant.,It reminds me of a dying engine.
153,2411141111110.json,I would describe this senation as a swollen pulsing.,This sensation makes me feel uncomfortable.,This sensation reminds me of a bad headache.
153,2411151004110.json,I would describe the sensation as one long vibration followed by a much shorter vibration.,N.A,This sensation reminds me of waking up to alarm that I did not set. 
153,2411131621110.json,Its intense and changing frequency.,It makes me feel impatient.,It reminds of trying to escape the traffic by speeding.
153,2411131121110.json,The signal gives me the sensation for intensing moving.,It makes me to feel arousing and noising.,It makes me to associated to study in a loud room.
153,2411141349110.json,This sensation feels like two vibrations together in intervals,This sensation make me feel doubtful,NA
153,2411141231110.json,There's one long vibration followed by six short vibrations.	,The sensation makes me feel worried.,It reminds me of the time I was late to class.
162,2411130944110.json,This signal can be described as a signal with waning intensity or becoming less instense untill it stops.,I feel like defeated.,This signal reminds me of missing a basketball shot and the basket keep vibrating and stops.
162,2411151103110.json,Sensation felt very steady long vibrating,Sensation made me feel Worried and guarded,Sensation felt like someones hungry stomach sound.
162,2411121648110.json,this sensation has short and repetative pattern with mild tone,this sensation makes me feel irritating,this sensation reminds me of doing someting i dont want to.
162,2411121537110.json,It was just ony long low frequency vibration that gradually decrese in implitude.,It makes me feel calm and content.,The vibrations is really similar to a cat's purr.
162,2411141111110.json,This sensation is like a low constant vibration.,This sensation makes me feel cautious.,This sensation  reminds me of a bad earthquake.
162,2411151004110.json,I would describe the sensation to someone else as a low humming sound as if there was construction work being done somewhat near my house.,The sensation makes me feel comfortable. ,This sensation reminds me of a drill. 
162,2411131621110.json,The sensation is less intense and smooth.,It makes me feel relaxed.,It reminds of massage.
162,2411131121110.json,The signal give me the sensation for moving slowing.,It makes me to feel like steady and calm.,It makes me to associated to walk quietly on my way home.
162,2411141349110.json,This sensation is contionous and single vibration,It makes me feel numb,NA
162,2411141231110.json,The sensation feels like a long vibration that dies down.,It makes me feel tired or unfocused.,It reminds me of driving on a dirt/gravel road.
155,2411130944110.json,This signal can be described as two small beats followed by a sudden burst of vibration or intensity.,I felt like I am alert.,"This is reminds me of something we say sixth sense, we sense that something is not right and keep observing and we find something or we obseve something all of a sudden. more like spidey sense."
155,2411151103110.json,Sensation felt very buzzing and machine like,NA,Sensation felt like someone is operating a buzzing machine
155,2411121648110.json,this sensation starts with two short beeps followed by 3 harsh buzz,this sensation makes me feel determined.,this sensation reminds me of being determined for my coursework
155,2411121537110.json,The sensation was two soft barely noticable pulse followed by three high frequency vibration where the interval between those three vibration gradually decreases.,It made me feel cheerful.,It reminds me of some of the orchestra I heard where they transition between movement.
155,2411141111110.json,I would describe this sensation as a clapclap dumdumdum.,N.A.,This sensation reminds me of a exciting phone alarmm vibration.
155,2411151004110.json,I would describe the sensation as a strong stable vibration to someone else.,The sensation makes me feel uncomfortable and anxious,The sensation feels as if someone is shouting at me for a mistake.
155,2411131621110.json,The sensation is varrying between intense and non intense bips.,It feels alarming.,It feels like a fire alarm.
155,2411131121110.json,The signal gives me the sensation for moving not really smoothly.,It makes me feel like a little bit panic and anxious.,It makes me to associated to not make my homework before the due.
155,2411141349110.json,This sensation is harsh at first and smooth in the next rythm,NA,NA
155,2411141231110.json,"It feels like two small vibrations followed by two big and long vibration, but there's a stop in the middle of the second big vibration.",It reminds me of the feeling of fear or surprise.,The sensation reminds me of the action of being scared. One moment it's fine the second moment there's a big jump.
156,2411130944110.json,This signal can be decribed as continuous and ends with mild intense vibration.,I feel like joyful.,This reminds me of a movie scene in which a couple starts dating.
156,2411151103110.json,Sensation felt fuzzy and stimulating ,Sensation made me feel calm and joyful,Sensation felt like a massage.
156,2411121648110.json,"this sensation are very puzzeled, it starts with short beeps followed by a wavey nature.",this sensation makes me feel very puzzled.,this sensation reminds me of playing chess.
156,2411121537110.json,"It was three long vibration with no pauses in between, the first and last vibration was lower in frequency and the middle one was higher frequency and stronger as well.",It made me feel daunted.,It reminds me like the background music when you are fighting against an enemy in a video game.
156,2411141111110.json,This sensation is like a raspy droning.,This sensationmakes me feel annoyed.,This sensation reminds me of wheezing.
156,2411151004110.json,I would describe the sensation as two fairly strong vibrations with a small gap in between to someone else.,N.A,The sensation reminds me of driving over two rough small patches of road back to back. 
156,2411131621110.json,The sensation if intense and varying frequency.,It makes me feel energetic.,It reminds me of riding a motorcycle.
156,2411131121110.json,The signals give me the sensation for moving somewhat regularly.,It makes me to feel I need to be attention.,It makes me to associated to get up in the moring when my clock is ringring.
156,2411141349110.json,This sentation makes me feel something is going in circles,It makes me feel dizzy,NA
156,2411141231110.json,It's a low vibration with a big vibration in the middle.,It fills me with the feeling of surprise.,It reminds me of suddenly braking in a car.
157,2411130944110.json,This signal can be descirbed as three intense beats and pause,i felt like i am agitated.,This reminds me of shooting someone in a RPG games like PUBG. 
157,2411151103110.json,Sensation felt like a rhythmical and steady,Sensation made me feel Confident and proud,Sensation felt like the vibrations I get from using a automatic Machine gun in a game.
157,2411121648110.json,this sensation is like short continous beeps along with a two strong beeps palying together..,this sensation makes me feel scared.,this sensation reminds me of watching a scary movie.
157,2411121537110.json,It was a soft high frequency vibration interminently spotted by a higher energy vibration.,The sensation makes me feel alive.,It reminds me of the background radiomagnetic noise of the universe.
157,2411141111110.json,This sensation is like the subtle chopping of sound waves.,This sensation makes me feel constricted.,This sensation reminds me of the sound of a nearby helicopter or large fan.
157,2411151004110.json,I would describe the sensation as three weak short pulses.,The sensation makes me feel happy.,The sensation reminds of when I go hiking and hear insect sounds.
157,2411131621110.json,The sensation is changing frequency at first and becomes smooth.,It makes me feel encouraged.,It reminds me of the feeling of getting something done.
157,2411131121110.json,The signals gives me the sensation for a little bit intense moving.,It makes me feel  nervious and hesitant.,It makes me to associated that I am calling to someone and wait for his/her's answer.
157,2411141349110.json,This sensation is soft an single vibration,It makes me feel patient,It reminds me of listening to smooth music
157,2411141231110.json,The sensation is a bunch of rapid vibrations followed by a long vibration followed by a weak long vibration.,"The sensation makes me feel surprised, but more in the sense of feeling like something is weird or unexpected.",It reminds me of a lawnmower or a weak electric razor.
158,2411130944110.json,This signal can be described as a continuous signal with low intensity but noticeable.,I felt like I am confused.,"This signal reminds me like when a microwave is done heating and it will alert us or a rice cooker makes whistle. We like notice the signal, however won't do anything or can't do anything."
158,2411151103110.json,Sensation was sticky and weird,Sensation made me feel discomfortable.,NA
158,2411121648110.json,this sensation has a repetative patterns of strong short beeps with a rythimic pattern,this make me feel like i am energized.,it reminds me of playing a song i like
158,2411121537110.json,"It was around 5 waves of vibration of the same pitch but different duration, the first wave was twice as long as the rest. The duration of the rest of the waves were similar but there is a light decrese in duration as it progresses.",It made me more energized.,N/A
158,2411141111110.json,This sensation is like an impatient buzzing.,This sensation makes me feel anxious.,This sensation reminds me of a phone alarm.
158,2411151004110.json,I would describe the sensation as four to five low frequency periodic pulses to someone else,The sensation makes me feel alert.,This sensation reminds me of when I walk past a growling dog.
158,2411131621110.json,The sensation is like a music beat.,It makes me feel joyful.,It reminds me of music.
158,2411131121110.json,The signals gives me the sensation for moving slightly intense.,It makes me feel like I  am somewhat tired.,It makes me to associated that I am sleep not really well last nigh.
158,2411141349110.json,This sensation starts smooth but its mild in the end,NA,NA
158,2411141231110.json,There's 4 short vibrations followed by a long vibration.,It makes me feel bored or unfocused.,It reminds me of doing a tedious task or shooting a pistol and then shooting an automatic gun.
159,2411130944110.json,This signal can be described as continous low intensity signal.,N.A,N.A
159,2411151103110.json,Sensation was very tender and neutral,Sensation made me feel like I was drained and Exhausted,Sensation felt like a amchine trying to sends its co-ordinates before shutting down.
159,2411121648110.json,this sensation is very short and mild.,this sensation makes me feel sad.,this sensation reminds me of losing in a game
159,2411121537110.json,"It was soft rhythmic pulses of vibration, the initial vibration was the longest and the other were shorter.",It made me feel sleepy.,It reminds me of the humm of an AC.
159,2411141111110.json,This sensation is like passive dragging.,This sensation makes me feel contempt.,This sensation reminds me of a massage gun.
159,2411151004110.json,I would describe the sensation to someone else as a very weak pulse.,N.A,This sensation reminds of when a small piece of plastic is stuck in my bicycles wheel and I do not stop to remove that piece.
159,2411131621110.json,The sensation is not intense and feels like fading.,It makes me feel like defeated.,It reminds me of missing a deadline.
159,2411131121110.json,The signal gives me the sensation for moving slow and slightly.,It makes me to feel exhusted and burn out.,It makes me to associated to run for 10 km mathroon.
159,2411141349110.json,this sensation is contious first and ends with 2 beats ,It makes me feel like distracted,NA
159,2411141231110.json,It's 4 short vibrations followed by two short but slower rhythm vibrations.,It makes me feel like something's ending.,It reminds me of an audience clapping and then it slowing down.
160,2411130944110.json,This signal can be described as a random signal.,N.A,N.A
160,2411151103110.json,Sensation was intense and sporadic and aggressive with vibrating and buzzing sensation.,Sensation made me feel agitated.,Sensation felt like an emergency alarm.
160,2411121648110.json,this sensation is a mixed of strong buzzes which ends with a continous buzz.,this sensation makes me feel being controlled.,this sensation reminds me of being in a examination room.
160,2411121537110.json,It was alternating lower and stronger vibrations and higher and softer vibration repeating twice where the last vibration was the softer and higher frequence vibration being held longer.,It made me feel alert.,It reminds me of a Nokia ringtone.
160,2411141111110.json,This sensation is like a stomp stomp roar.,This snesation maes me feel shaken.,This sensation reminds me of a vibration coming from an adjacent room.
160,2411151004110.json,I would describe the sensation as a strong continous vibration to someone else.,The sensation makes me feel strong.,The sensation reminds me of when I shoot a gun in a gameplay. 
160,2411131621110.json,The sensation is changing frequency and is intense.,It makes me feel confused as it keeps changing the pattern.,It reminds me of attending a mexican program where I dont understand the language.
160,2411131121110.json,The signal gives me the sensation for moving slightly neat and fast.,It makes me to feel funny and energetic.,It makes me to associated that I have a pleasureable chat with my friend.
160,2411141349110.json,I can feel three vibrations at once all feel smooth,This makes me feel baffled,NA
160,2411141231110.json,It's a long vibration followed by two medium length vibrations followed by another long vibration.,It makes me feel excited like there's something going on.,It reminds me of beyblades like there's an intense battle going on.
129,2411121048190.json,"I would describe this as a discrete, somewhat fast paced, signal. I would say it not a super strong signal, actually kind of faint. Initial the signal is quite harsh, but leaves in a decaying fashion over about a third of second. ","It makes me feel kind of emotions of whimsy, kind of calming. ",I would say this reminds of like trying to hold on to a butterfly. If it really - in a persistent way - wanted to leave my hands. 
129,2411121345190.json,sensation to someone else feels like a blinking .,NA,sensation feels like blinking an eye.
129,2411120914190.json,This signal has soft consistent vibrations ,This sensation makes me feel pleasant and is enjoyable. ,This sensation reminds me of a massager
129,2411121437190.json,Sensation is a continous beep sound.,Sensation makes me feel energized.,Sensation reminds me of water drops falling.
129,2411061808190.json,"If I were to describe this sensation to someone else, I would say that it is vibrating kind of sensation. It is like my iPhone getting a call from someone and the iPhone starts to vibrate.","The sensation makes me feel more attentive, and sometimes annoying. ","Yes, this does remind me of the alaram that rings everyday on my iPhone when I wake up in the morning."
129,2411091732190.json,i would describe the sensation as continuous beats with fast pace (to be technical with less time period),"sensation make me feel alerted,alarmed,panicky","It reminds me of my alarm,also my panicking/anxious moments."
129,2411071515190.json,I would describe this as fast rhythmic sound.	,This sensation makes me feel energized. ,This reminds of of travelling in a train.
129,2411081047190.json,The sensation felt like tiny soft taps on my palm.	,The sensation makes me feel a bit irritated.,"By brother used to annoy me with such taps till he gets my attention, hence a little annoying."
129,2411091146190.json,"This sensation is quite soft, which is very calm and peaceful it didn't feel anything unsual","Sensation made me feel relaxed and good, its is soft and smooth","This sensation felt like I am handling something quite lite and easy, it reminded me of tiny mobile vibration"
129,2411101817190.json,The sensation is constant and light.,N.A.,The sensation feels like taking a bike ride on a consistent gravel road.
130,2411121048190.json,"I would describe this sensations by telling a person it was a petering sensation. Which initially would come on kind of strong, but would kind roll off and restart. I would describe this as an inconsistent sensation as well. ","This makes me feel kind of uneasy, because the sensation is not smooth.  ","If I had to put this into words. I would say it comes on a little strong and then it feels like a frog croaking. If I were to put an audible sound, like an ontamatapiea (sp?), I would say is feels like, ""crrrr-crrr-crrroak"". Kind over and over again. With short maybe quarter second breaks in between."
130,2411121345190.json,sensation feels like bumpy,sensation make me thrilled	,NA
130,2411120914190.json,This sensation is a contibuous vibration which repeats after a longer duration.,This sensation makes me feel energetic like something is starting,This sensation reminds me of how it feels when a car starts
130,2411121437190.json,Sensation is like a motor running.,Sensation makes me feel baffled.,Sensation felt like a bike reving.
130,2411061808190.json,I would describe this sensation as a calm wave hitting your fingers and also a natural vibration at the same time. ,It makes me feel calm and composed.,This reminds me of the focus music with different hz that are available on youtube. It also reminds me of having control of the steering wheel while the car is not moving.
130,2411091732190.json,The sensation was continuous with medium pace,sensation makes me feel cheerful,It reminds of being active  and cheerful
130,2411071515190.json,I would describe this an inconsistent vibration.		,This makes me feel discomforting.,This reminds me of using a drill machine.
130,2411081047190.json,The sensation felt like a car running on my hand.,The sensation made me feel like I was riding a car on a console and taking a soft right turn.,It kind of reminds me of console car games haptic feedback.
