signal_index,file_name,free_text_sensory,free_text_emotional,free_text_association
14,2409171344123.json,"It is short period vibration, somehwat like a beat to some fast paced music. Something your head would start nodding to.",It makes me feel energetic.,It reminds me of certain beats in some music I have heard before.
14,2409181012123.json,"sensation was like a massage mode , the mode was swirl and felt like a roll in my palm as if there is a circular roller inside which is moving with a swirl effect",sensation made me feel relaxing and had active emotions,this reminds me of my massage machine that i had back in hometown that had a swirl mode which gives you massage in a circular manner continuosly like a ball rolling inside my hand
14,2409141902123.json,it is a fast on off vibration pattern.,N.A.,It reminds me of a game controller.
14,2409110853123.json,The sensation is like some peeling sound ,it feels tender,Carpent soomthing the edges
14,2409111638123.json,This sensation feels like a vibration from an emergency vehicle,It makes me feel alarmed,It reminds me of an ambulance
14,2409121917123.json,it feels like a washing machine rotating,N.A.,a washing machine spinning
14,2409121205123.json,This sensation feels like a car or bike trying to start but is not able to. ,This sensation makes me annoyed as it closely resembles when I am trying to start a car but it won't turn on. ,This remoinds me of my bike back home that takes 2-4 tries to turn on. 
14,2409111019123.json,The vibration feels pleasant,It feels calm and enjoyable,It reminds me of the vibration from a bluetooth speaker
14,2409041624123.json,The short notes in the violin.,Makes me feel like something is in a hurry and others should me made cut short.,It does remains of the short and cut strokes in violin.
14,2409041136123.json,This is a very short vibration playing on repeat,I feel no specific emotion about it,If you run a ruler over a comb you will get this vibration
14,2409041711123.json,It is like someone is trying to irritate you,It makes me feel irritated,It reminds me of the times I got irritated when someone sitting behind me used to disturb me in class
16,2409200923123.json,This sensation was characterized by a steady vibration with pulses of more intense vibration occurring at rapid equal intervals. ,This sensation made me feel slightly nostalgic. ,This sensation reminds me of the time an old friend and I would play with toy cars as kids and race them around tracks. 
16,2409171344123.json,It feels like a muffled vibration something you would feel if you were underwater and inside a fast submarine.,It makes me feel intense.,It reminds me of a video I saw of a submarine under water.
16,2409181012123.json,this sensation is same as you swallow pulpy juice inside in one sip so you can feel the thrill in your neck and chest,this sensation made me feel pleasant and had had buzz emotions to it,"i was drinking pulpy orange juice yesterday in one sip and i could feel this same sensation in my neck and chest , this also reminds of my sports day practise"
16,2409141902123.json,it is an alternating on pattern with two different frequencies but the transition between the frequencies is smooth.,I feel pleasant.,i am reminded of a massage chair.
16,2409110853123.json,the vibration is like drilling,its vibrating ,MRI machine
16,2409111638123.json,The sensation feels like something twitching,It makes me feel uneasy,This reminds me of numbness
16,2409121917123.json,it feels like playing with the long jiggling springs,it makes me happy,it feels like the vibrations you feel while moving the long springs between your hands
16,2409121205123.json,The sensation felt like when you are racing a car in a game and the sensation you feel. ,This sensation makes me feel good as it is attached to playing games. ,It reminds me of playing car racing games or Mario cart with friends. 
16,2409111019123.json,The vibration is a continuous one,It feels relaxing,It reminds me of getting a head massage 
16,2409041624123.json,Creates the feel as if I'm touching the surface of a Table fan.,"Creates a wave kind of feel. Relaxed at a time and peaks at the other, Feeling discomfort in some extent.","Touching the pedastal of the running pedastal fan does feel the same.
"
16,2409041136123.json,This has a low and high occilation alternating but continuous vibration,It makes me feel good or content,It has a feeling of a hair trimmer or when you go to a barber's shop and they trim your hair with a trimmer 
16,2409041711123.json,It is similar to the vibrations you get when you are in a concert,It makes me feel happy and excited,It reminds me of the vibrations on the floor caused by the music in the concerts
17,2409200923123.json,This sensation was characterized by rapid short vibrating pulses. ,"This sensation made me feel anxious, as though I am about to enter a very difficult situation.",I have not experienced anything quite like this before. 
17,2409171344123.json,"It feels like the white noise of when you are sprinting in a race and you block your mind to the surroundings, and are focussing on running.","It is making me feel unpleasant, as though I do not know what is going on.",It reminds me of the white noise I hear when I am sprinting in a race and I am focussing on the run.
17,2409181012123.json,"this is a drum beat of rythm 4 , so first it will beat for 4 time continously then take a minute pause and then again repeat the pattern",feels like a drum beat that had a dance music element in it giving dancing emotions,"i had to dance on a song and this were the exact beats that we used to showcase fast dance moves and also give a small drop , so it was liek a quick 1234 beat step with a sec of pause drop and then again same process of dance effeceintly"
17,2409141902123.json,this is a on off fast alternating pattern of vibration where the each phase has same time interval.,i feel annoyed.,i feel like i am driving down a rocky road.
17,2409110853123.json,it like Hammering,its feels exciting ,I can associate with person saying NO in panic
17,2409111638123.json,This feels like travelling in a public vehicle,It makes me feel neutral,This reminds me of a bus
17,2409121917123.json,it is a rapid burst of vibration ,it makes me feel scared,it reminds me of the sitting in a rotary engine car
17,2409121205123.json,This sensation felt like heavy objects dropping on the floor one by one. ,It makes me feel like there is something falling from the roof one after the other. ,It feels like I am throwing stones from a height on the ground. 
17,2409111019123.json,The vibration is uneven and unpleasant,It makes me uncomfortable,It reminds me of the time when in traffic 
17,2409041624123.json,NA	,NA	,NA
17,2409041136123.json,Very short and very fast signal sensation,It creates excitment as well as anxiety ,This feels like a buildup to something. 
17,2409041711123.json,This sensation has a rhythm of counting till 4,It makes me feel concentrated,It reminds me of the time I used to play drums and I had to follow a particular rhythm
18,2409200923123.json,"This sensation can be described as two short ticks and then a longer vibration, repeating at equal intervals. ",This sensation made me feel happy.,"This sensation is similar to a common beat in music, and I noticed the desire to dance and groove along with it, which makes me happy. "
18,2409171344123.json,It is like 2 small knocks followed by a longer vibration.,It makes me feel anxious.,It feels like someone has knocked on my door and is then entering the room I am sitting in.
18,2409181012123.json,"this gave a vibrating sensation , like a drill machine with adjust accuracy that has to first find its spot with 2 beats then drill for few seconds",this sensation made me feel vibrating and gave an warm emotion,"this reminds me of construction site that i ahd visited way back , i can associate a drill machine with is faulty sensation with this"
18,2409141902123.json,This is an on off pattern where the first two on phases have a small time interval and the last on phase has an increasing vibration pattern.,This sensation annnoys me.,This reminds me of a CFL tubelight switching on because the first two times it doesnt switch on fully and the third time it does.
18,2409110853123.json,"Sensation is mix of 2,  Knocking and dragging",It feels unpleasant,Knocking the door
18,2409111638123.json,This feels like the vibration of a wearable,It makes me feel aware,This reminds me of break reminders I get from my smart watch
18,2409121917123.json,it feels like morse code with 1 main click and 2 small clicks,n.a.,it reminds me of morse code.
18,2409121205123.json,The sensation invloved two small beats foollowed by a longer dragged beat. ,"This sensation feels like music beats when you practice to dance and the beats goes 1,2 and a beat. ",This reminds of dance lessons and a teacher yelling beats when we have to practice the same step multiple times. 
18,2409111019123.json,The sensation feels neutral,It is rhythmical,It reminds me of pleasant music 
18,2409041624123.json,Tap on someone.,Creates a feel like someone calls and asks to proceed with something.,"Experienced this while the indicator is on in the car, and further an acceleration does provide the same feel. "
18,2409041136123.json,This has 2 short pulses and 1 long vibration,Feels good in the hand like you are staring some engine or machine,"It feels like you are gving a command to a machine, clicking some buttons and motor starts"
18,2409041711123.json,This is like another alarm vibrations,It does not make me feel in any particular way,It reminds me of an alarm vibration
24,2409200923123.json,This sensation can be described as someone furiously typing a long message on a phone keyboard with haptic feedback turned on.,"This sensation made me feel slightly anxious and angry, as those emotions are when I am most likely to type a long message. ",I am reminded of the times when I was anxious or angry and needing to send out messages to people to accurately convey my emotions or to resolve conflict.
24,2409171344123.json,It is really short and really fast vibrations.,It makes me feel excited.,It feel like me shooting a gun in a video game that I enjoy playing.
24,2409181012123.json,this sensation is of rain droplets hitting the roof top and you are hearing the fast rain tapping sound under the roof,sensation and emotion felt quite nostalgic as it is similar to the rains,"yesterday it rained in arizona , i was sitting under a roof top and can hear the fast tapping noice of rain hitting the roof and crearting a soothing enviroment"
24,2409141902123.json,This pattern is an on off pattern with faint quick vibration.,"I feel discomfort, because this pattern feels incomplete.","I pattern feels like eating sand, as it is grainy and coarse."
24,2409110853123.json,it is quick and rythmic feels like Lub Dub sound in 5X speed,it feels like greasy,Vibration reminds the engine on of the tractor
24,2409111638123.json,This feels like twitching in palm,It makes me feel uneasy,This reminds me of the sensation I get when my palm is twitching
24,2409121917123.json,it feels like a constant clicking sound,it makes me feel inspired,it reminds me of shooting guns at the shooting range
24,2409121205123.json,This sensation feels like fast water hitting a window pane. ,The sensation makes me feel happy as for me it indicates fast rain hitting a window. ,This reminded me of heavy rain season when you can hear the rain hitting your window and wall. 
24,2409111019123.json,The sensation is sporadic,It feels annoying,It reminds me of people firing their guns continuously
24,2409041624123.json,Indication to do something.,Asking to proceed.,"While crossing the road, the sound created by the signal to proceed with the cross walk does remind the same."
24,2409041136123.json,Very short ticks or vibration,They feel good and small,It reminds me of a diler tone when you call someone and you listen to the tone before the other person answers the call
24,2409041711123.json,It feels like heavy rainfall,It makes me feel cool and relaxed,It reminds me of the times I was playing football in rain
25,2409200923123.json,This sensation is similar to someone typing a message on their phone with haptic feedback on at a moderately rapid pace. ,This sensation elicited an emotion of amusement out of me. ,This sensation reminds me of the many times I have seen older people use smartphones and type out messages using only one finger to press one key at a time. 
25,2409171344123.json,"The vibrations are short, fast paced and mellow.",It makes me feel comfortable.,"It feels like when I have some fruits grapes/ any round objects and I am washing it and emptying the container, into a container filled with water, and the splattering sound of multiple grapes falling is what this vibration is reminding me of."
25,2409181012123.json,"this felt like a fast leaking water , so if you place your hand below the leaking tap water that has a fast continuos flow",sensation made me feel good but had anxious emotions associated with it,once my water tap broke and i quickly hold my hand onto it the flow wad fast but leaking so i could feel simialr sensation their
25,2409141902123.json,This pattern feels like an on off sensation where the on and off periods of vibration are equal.,"I feel dissatisfied, there is no intensity to the pattern.",This reminds me of water dripping down the sink.
25,2409110853123.json,Placing hand on the steady started bike,its like machine on ,Royal Enfeild Bike 
25,2409111638123.json,This sensation is like that of an elevator,It makes me feel comfortable,This reminds me of being in an elevator or an escalator
25,2409121917123.json,it feels like blades spinning,it makes me feel excited,it reminds me of helicopter blades spinning rapidly before takeoff.
25,2409121205123.json,The sensation were fast beats but of low intensity. ,I did not feel any particular emotion with this sensation. ,I don't remeber feeling this sensation before. 
25,2409111019123.json,The vibration is constant,The sensation feels urgent,It reminds me of the action like someone knocking the door
25,2409041624123.json,Looking at the fast dropping drips does creates this feel.,Feel something is falling or fast flowing.,"Yes, while being provided with as intravenous drips, the medicinal flow from the drips if controlled fastly, would create the same feel."
25,2409041136123.json,This feels like equally spaced sensations in the hand,This is exciting I don't know why,NA
25,2409041711123.json,It is like using an automatic rifle,It makes me feel tensed,It reminds me of the vibrations of the bullets leaving from an automatic rifle
26,2409200923123.json,The sensation is characterized by moderately short vibrating pulses at moderately short intervals. ,The sensation made me feel slightly anxious and overwhelmed.,This sensation reminds me of getting many notifications for a variety of different things all at once. 
26,2409171344123.json,It is a period sensation of 3 unevenly timed fast vibrations one after the other and then repeating.,It is making me feel irritated and is giving me a sense of urgency.,It feels like an alarm on my smart watch in the morning.
26,2409181012123.json,"this is a south indian dance music song beats , one in the right then two in the left with a minute vibartion disc at the end , the beats are fast giving a perfect msuical vibe",sensation were quite dj vibes and made me feel energetic emotions as it was like a rock song,this reminded me of keeping my hand on my speaker while playing a dj south indian song which ahd similar beats and musical vibraition
26,2409141902123.json,"This is an on off vibration pattern where the time period of the first on is larger than the second, third, and fourth on with off periods of equal time period in between.",I feel happy when i feel this sensation.,This reminds of skating down a smooth floor.
26,2409110853123.json,the sensation is Fast Rythmic beat with vibration,it feels like Panicky,I can Associate with shaking a bottle of pepples 
26,2409111638123.json,This feels like vibrations from a swing,It makes me feel happy,Reminds me of a slow swing
26,2409121917123.json,it feels like a 1-2-1 sequence of clicks,it makes me feel athletic and inspired,it reminds me of boxing.
26,2409121205123.json,This is the sensation of your alarm or phone ringing in your pocket. ,This makes me feel like I am late for something as this reminds me of my alarms in the morning. ,This reminds of my alarm vibrating under my pillow in the morning. 
26,2409111019123.json,The vibration is intense but enjoyable,It feels energetic,It feels like people dancing in a place with loud music
26,2409041624123.json,Sensation as of scanned and the content being printed.,Creates a feel as some action / work is been completed.,"When we touch the printer while its printing something, it gives the exact same feel."
26,2409041136123.json,This is a very fast paced beat with one long beat and 2 short taps,I feel very excited and happy or cheerful with this vibration,It is like a music beat with heavy bass
26,2409041711123.json,It is like a rock music,It makes me feel excited and happy,It reminds of listening to a rock music and the beats in it
30,2409200923123.json,This sensation seems to be characterized by short vibrating pulses at slow and somewhat irregular intervals. ,This sensation makes me feel confused. ,I am reminded of the times I have heard bass-heavy pop songs that I do not enjoy and struggled to find a sense of rhythm in the song.
30,2409171344123.json,Multiple different types of vibrations of increasing lengths.,"It makes me feel excited, like when I am about to watch a movie.","It is like an intro sound to movies starting, a very famous prodction house, I am not able to remember the name of."
30,2409181012123.json,discomforting motion vibrations that were to and fro on the walls with irregular manner,i felt vibrating sensation with discomfort emotion as the walls were vibrating in irregular manner and also not pleasent enough,this reminds of keeping your hand on a engine and feeling the vibrating groove inside it but also it should be not working properly for it to replica the vibrations and sensations
30,2409141902123.json,This is an on off pattern with sequential on vibrations in between a long period of no vibration.,I feel sleepy when I listen to this.,This reminds me of snoring.
30,2409110853123.json, the couple of short vibration at the start and ends with long vibration ,It feels quiet and sharp,I can associate with wall drilling 
30,2409111638123.json,The sensation of a faulty appliance,It makes me feel irritated,It reminds me of trying to use an appliance that is not working properly
30,2409121917123.json,it feels like someone playing the drums ,it makes me feel happy and energetic,it reminds me of the loud vibrations from drums at concerts or events
30,2409121205123.json,The sensation were very uneven beats and with no pattern. ,The sensation felt like a song that has multiple beats playing at the same time. ,It feels like I am listening to a song that heas multiple beats going on at the same time and has no pattern it is following. 
30,2409111019123.json,The sensation is weird and unfamiliar,The sensation feels neutral,N.A.
30,2409041624123.json,NA,NA	,NA
30,2409041136123.json,"The vibration is more like a growl, soft and long with intervals in between",I feel adventurous,"Feeling like accelerating a beach buggy, vibrations you get form the accelarator handle"
30,2409041711123.json,It is like someone is delivering a dialogue or singing,It makes me feel wanting to know more,It reminds of listening to speeches
31,2409200923123.json,This sensation is characterized by moderately short vibrating pulses at very rapid intervals - there is hardly any space in between each pulse. ,This sensation made me feel anxious.,This sensation reminds me of the way my heart rate increases when I get anxious.  
31,2409171344123.json,A periodic rhytymic vibration.,It makes me feel passive.,It reminds of someone hitting their drumsticks on drums one hand after the other trying to make a build up to some situation.
31,2409181012123.json,"rolling voice that is similar to beatbox , linear voice but with 1 1 3 musical beats with punches in the end",this made me feel like i can feel my beatbox rythm giving thrilling emotions,whenver i beatbox and cover my mouth with my hand using similar beats is can be sensing the same feels and also the punch in musical manner
31,2409141902123.json,This is a sporadic pattern of on and off vibration.,I feel excited when I feel this.,This reminds me of Brownian motion in molecules.
31,2409110853123.json,"The sensation is strong, sharp and fast vibration ",it feels aggressive and alarming ,I can associate with the fire alarm 
31,2409111638123.json,The sensations from heavy machinery or a factory,It makes me feel heavy,This reminds me of visiting factories
31,2409121917123.json,it feels like a burst of shots,it makes me feel a bit tense and nervous,ir reminds me of firing with a machine gun in burst rounds.
31,2409121205123.json,This sensation felt like loud music playing aon a huge speaker near you. ,I feel good as it makes me feel like I am listening to fast music. ,It reminds me of going to a party and dancing to lound music playing around me. 
31,2409111019123.json,The vibration is intense,It feels panicky,It reminds me of alarm from phone
31,2409041624123.json,Touching the surface of any machine while its running.,Creates a feel as if something is executed.,"Yes, while touching the washing machine, while its running does provided me a similar feel."
31,2409041136123.json,It feels like  avery loud vibration,I feel I am in danger,Feels like an alarm going off with heavy tone
31,2409041711123.json,This is gives me a disco or party vibe,It makes me feel happy and excited ,It reminds me of going to parties and grooving to the music
2,2409201459112.json,This pattern feels like two sets of mobile rings with different lengths.		,This sensation feels simulative.,This reminds me a varied vibration of a mobile phone.
2,2409191326112.json,This pattern feels like a heart beat.,It feels a bit anxious about this sensation,It reminds me of listening to the heart beating through a sthethoscope
2,2409111115112.json,"It is pretty mild, can hardly feel it,",It does not make me feel alert.,"Yes, it closely resembles the pattern of a human heart beat."
2,2409111557112.json,The buzzing vibration replicates hearbeat. It can explained as a fast heartbeat when a person is feeling stressed.,The sensation made me feel anxious and stressed. It was because of the fast pacing.,This reminded me of a game controller vibration pattern it makes when my character's health is low.
2,2409100934112.json,i can descride the sensation as the one i feel while holding a vibrator,i can just feel a light buzz,it is like a heart beating sensation
2,2409111711112.json,It feels like cell phone vibrations when phone is on vibration mode.,IT makes me feel like something needs attention.	,It reminds me of time when i get the phone notifications.
2,2409061806112.json,reminds me of a morning alarm that eases into getting your attention but does not irritate you.,"it draws my attention, but is calming at the same time.","i associate this with a morning alarm on a phone, but it is not as annoying."
2,2409040948112.json,It kinda felt wierd as I perceived it as a heartbeat. I felt it was subtle and not alarming.,It made me feel calm. Some emotions I felt were exciting.,no I actually haven't experienced this kinda sensation or a haptic before. I feel its very unique and new for me.
2,2409051649112.json,I would describe this sensation as a beeping vibration.,"This sensation felt familiar, i just felt passive to the sensation",I feel like i've felt it previously almost like a spaced out phone ringing or a timer that just went off thats currently still on 
2,2409041034112.json,"A sesnsation that resembles my alarm vibration, beats every 2 seconds","Like a ""wake up call"" or a ""reminder""",It reminds me of my alarm every morning
3,2409201459112.json,This sensation feels like a single prolonged beep breaking down all of a sudden.,This sensation isn't comforting.,NA
3,2409191326112.json,This sensation is a rapid 4 count beat.,Feels like playing a guitar cord,It reminds me of striking the same cord of a guitar four times
3,2409111115112.json,A vibration with strength between mild and strong,It makes me feel alert,"It resembles a faster heart beat, something that could occur after one has exercised."
3,2409111557112.json,I would describe this pattern as a nudge. It feels like a nudge on the back of the shoulder when you tap someone.,It made me feel like another human is trying to connect to me. As a tap on the shoulder or like a phone call vibration a phone makes.,A phone call vibration pattern made by a smartphone or a morning alarm vibration pattern that I have felt before numerous times.
3,2409100934112.json,it is like a constant vibration without any drops or ups.,it makes me feel pleasent.,i get the sensation i get when i touch a washing machine
3,2409111711112.json,This sensation reminds me of game controller and specifically Need for Speed Car crash.,It makes me feel like i am playing NFS and having a good time.,"Yes, It reminds me of time i used to play Need for Speed."
3,2409061806112.json,"it's a repititive and strong pulse, felt every so often","It makes me feel anxious, and panicky.","it is similar to a jackhammer, strong and repetitive"
